Category,Year,Statement,TaxonomyA_Categories,TaxonomyA_Explanations,TaxonomyB_Categories,TaxonomyB_Explanations
Brookfield_Asset_Management,2023,"Net zero by 2050 or sooner ambition across Operationally Managed investments1, and target to reduce emissions by at least 50% across $263B of AUM by 2030","3, 4","This statement includes a specific numeric target for reducing emissions by at least 50% across a certain amount of assets under management by 2030. | The company has a net-zero target by 2050 or sooner, which is a specific type of carbon-neutral target.",,
Brookfield_Asset_Management,2023,"Commissioned 57% of new clean energy capacity in 2023, totaling ~8,000 MW since 2021",,,3,"This statement acknowledges progress towards a past commitment, as it mentions the commissioning of new clean energy capacity in 2023."
Brookfield_Asset_Management,2023,"10.5 GW of new renewable energy capacity to be delivered to Microsoft in the U.S. and Europe between 2026 and 2030, announced in a first of its kind agreement",3,This statement includes a specific numeric target for delivering new renewable energy capacity to Microsoft between 2026 and 2030.,,
Brookfield_Asset_Management,2023,"We are members of the IFRS Sustainability Alliance (IFRS), a global Sustainability Governance initiative since 2021 and are committed to supporting the ambition of achieving net-zero GHG emissions by 2050 or sooner, emphasizing our alignment with the Paris Agreement.",4,The company has a net-zero or carbon-neutral target.,,
Brookfield_Asset_Management,2023,"In 2021, we became supporters of the Task Force on Climate-related Financial Disclosures (TCFD).",2,The company has a generic/high-level commitment to support TCFD.,2,"The company mentions a past commitment to support TCFD, but the status is unknown."
Brookfield_Asset_Management,2023,"We have been signatories to the Principles for Responsible Investment (PRI) since 2020, which reinforces our long-standing commitment to responsible investment and sustainability best practices.",2,The company has a generic/high-level commitment to responsible investment and sustainability best practices.,3,The company acknowledges progress/achievement of being signatories to the PRI since 2020.
Brookfield_Asset_Management,2023,"In 2023, our reporting real estate entities achieved an average global GRESB score of 86% in the Standing Investments Benchmark, a five-point year-over-year increase and an average score of 92% in the Development Benchmark, a two-point year-over-year increase.",,,3,The company acknowledges progress/achievement in improving their GRESB scores.
Brookfield_Asset_Management,2023,"We are committed to upholding strong practices to monitor and oversee our business, including our overall approach to sustainability.",2,"The company has a generic/high-level commitment to uphold strong practices to monitor and oversee their business, including their approach to sustainability.",,
Brookfield_Asset_Management,2023,The Net Zero Steering Committee oversees Brookfield’s decarbonization strategy and initiatives.,4,This statement refers to a Net-Zero or Carbon-Neutral Target commitment.,,
Brookfield_Asset_Management,2023,"Net Zero Operational Committee: This group comprises functional, sector and technical experts across the organization with a mandate to execute the priorities set out by the Net Zero Steering Committee.",5,This statement refers to a Detailed Plan or Roadmap for achieving the company's net-zero target.,,
Brookfield_Asset_Management,2023,We seek to embed material sustainability considerations and evaluate risks and opportunities related to sustainability and its implications for value creation opportunities throughout Brookfield our investment process.,2,This statement refers to a Generic/High-Level Commitment to sustainability.,,
Brookfield_Asset_Management,2023,"As part of investment due diligence1, Brookfield seeks to assess sustainability-related opportunities and risks and factor them into the overall investment decision.",2,This statement refers to a Generic/High-Level Commitment to sustainability in the investment process.,,
Brookfield_Asset_Management,2023,"Management teams regularly report to their respective boards of directors from both financial and operating perspectives, including key performance indicators that incorporate material sustainability factors, such as health and safety, environmental management, compliance with regulatory requirements, and, increasingly, GHG emissions.",2,This statement refers to a Generic/High-Level Commitment to sustainability reporting.,3,This statement refers to Acknowledged Progress / Achieved in terms of sustainability reporting.
Brookfield_Asset_Management,2023,We adhere to a robust risk management framework and methodology that is designed to enable comprehensive and consistent management of risk across the organization.,2,"This statement refers to a high-level commitment to manage risk, including climate-related risk, across the organization.",,
Brookfield_Asset_Management,2023,"We will continue to consider ways to further integrate climate-related considerations into our risk management processes for these investment types, including the incorporation of our own learnings and best practices.",5,This statement refers to a future plan to further integrate climate-related considerations into risk management processes.,,
Brookfield_Asset_Management,2023,"We consider climate-related risks and opportunities over three time periods (short, medium and long-term), as the nature of these risks and opportunities can differ depending on the time period considered.",5,This statement refers to a detailed plan to consider climate-related risks and opportunities over different time periods.,,
Brookfield_Asset_Management,2023,"Our assessment of climate-related risks and opportunities is integrated into our overall risk management process, which is used to inform a holistic view of our risk profile and mitigation strategies.",5,This statement refers to a detailed plan to integrate the assessment of climate-related risks and opportunities into the overall risk management process.,,
Brookfield_Asset_Management,2023,"We will continue to focus on enhancing our climate risk management processes and consider ways to further engage with our portfolio companies and, as such, our approach to risk management and reporting may change over time.",5,This statement refers to a future plan to enhance climate risk management processes and potentially change the approach to risk management and reporting.,,
Brookfield_Asset_Management,2023,"While climate-related risks and opportunities will generally vary based on the nature of a business, we view GHG emissions as a potential source of transition risk for all of our portfolio companies.",2,This statement refers to a high-level commitment to view GHG emissions as a potential source of transition risk for all portfolio companies.,,
Brookfield_Asset_Management,2023,"Two years ago, Brookfield Renewable Power & Transition's business set a target to develop an additional 21,000 MW of new clean energy capacity by 2030 or the equivalent of doubling the size of its portfolio from that time.",3,This statement refers to a specific numeric target set by the company for future carbon emissions reduction.,2,"This statement refers to a past commitment made by the company, but the status of this commitment is not explicitly stated."
Brookfield_Asset_Management,2023,"It is making great progress towards this target, with 8,000 MW added since the beginning of 2022, including 5,000 MW in 2023.",,,3,This statement acknowledges progress towards a past commitment.
Brookfield_Asset_Management,2023,"To achieve the global goal of net-zero emissions by 2050, there must be a transformation of the global electricity capacity mix with the share of renewable energy shifting from 30% in 2022 to about 60% by 2030.",4,This statement refers to a net-zero or carbon-neutral target for future carbon emissions reduction.,,
Brookfield_Asset_Management,2023,"Our North American Residential Decarbonization Infrastructure business, Enercare, is facilitating the decarbonization of Canadian homes through its heat pump and tankless water heating offerings, as well as by supporting provincial conservation and demand management programs.",2,This statement refers to a generic/high-level commitment to future carbon emissions reduction.,,
Brookfield_Asset_Management,2023,"Telecommunications providers and data centers will also play a meaningful role in transitioning to a low-carbon and energy-efficient future by, for example, supporting increased process efficiency in industrial applications.",2,This statement refers to a high-level commitment to transition to a low-carbon and energy-efficient future.,,
Brookfield_Asset_Management,2023,"We provided capital to InterEnergy to fund growth and contribute to its plan to achieve net zero by 2050, which is underpinned by shifting its fuel mix from thermal to renewable energy.","4, 5","This statement refers to a specific net-zero target by 2050. | The statement also mentions a detailed plan to achieve this target, which includes shifting the fuel mix from thermal to renewable energy.",,
Brookfield_Asset_Management,2023,"InterEnergy partnered with Brookfield to develop a structured decarbonization transition plan with mid- and long-term goals, including specific emission intensity targets by 2030 and net zero by 2050.","3, 4, 5",This statement refers to a specific numeric target for emission intensity by 2030. | This statement also refers to a specific net-zero target by 2050. | The statement mentions a detailed decarbonization transition plan with mid- and long-term goals.,,
Brookfield_Asset_Management,2023,"In 2023, it commissioned and acquired approximately 37 MW of renewable power capacity, and it expects to bring on an additional 144 MW of capacity by the end of 2024.",3,This statement refers to a specific numeric target for renewable power capacity by the end of 2024.,3,This statement acknowledges progress made in 2023 towards increasing renewable power capacity.
Brookfield_Asset_Management,2023,"By 2026, our U.S. office portfolio will procure 100% of its electricity from clean energy sources.",3,This statement refers to a specific numeric target for procuring 100% of electricity from clean energy sources by 2026.,,
Brookfield_Asset_Management,2023,"The ultimate path of a transition to a net-zero economy is highly uncertain and will vary by sector, industry and geography. We believe that we can make a meaningful contribution through our investments that will support a net-zero transition and through our efforts to operationalize decarbonization across our assets that have higher emissions footprints.",4,This statement refers to a future commitment to support a net-zero transition and decarbonize assets with higher emissions footprints.,,
Brookfield_Asset_Management,2023,"As further described in Our Climate Strategy, a key imperative of our strategy to address transition risk is to engage with our portfolio companies on value-enhancing decarbonization strategies, as well as to explore value chain opportunities.",5,This statement refers to a detailed plan or roadmap for addressing transition risk and decarbonization.,,
Brookfield_Asset_Management,2023,"Our operations professionals engage with our portfolio companies on transition and decarbonization strategies, including by providing training and sharing of best practices for emissions measurement and goal setting, identifying decarbonization levers.",5,This statement refers to a detailed plan or roadmap for engaging with portfolio companies on transition and decarbonization strategies.,,
Brookfield_Asset_Management,2023,"Physical risk mitigation and adaptation strategies differ depending on the type of asset and its level of vulnerability to a particular physical hazard. In managing physical risks, structural integrity of an asset under different weather conditions and the suitability of insurance coverage are two areas of focus during acquisition due diligence and ongoing portfolio management.",5,This statement refers to a detailed plan or roadmap for managing physical risks and adapting strategies based on the type of asset and its vulnerability.,,
Brookfield_Asset_Management,2023,We will continue to work with our portfolio companies in further enhancing their physical risk mitigation and adaptation strategies by providing support for operational and other improvements and sharing of best practices.,5,This statement refers to a detailed plan or roadmap for continuing to work with portfolio companies to enhance their physical risk mitigation and adaptation strategies.,,
Brookfield_Asset_Management,2023,The number of assets exposed to coastal flooding risk is not projected to change significantly under the long-term higher emissions scenario.,3,This statement refers to a specific numeric target related to the company's future projections of assets exposed to coastal flooding risk.,,
Brookfield_Asset_Management,2023,Risks were previously identified and mitigation strategies vary by asset type.,,,3,This statement acknowledges progress in identifying risks and implementing mitigation strategies.
Brookfield_Asset_Management,2023,"Mitigation strategies are in place and continue to be improved, including, where applicable, vegetation management plans that meet or exceed industry standards.",5,This statement refers to a detailed plan or roadmap for improving mitigation strategies.,3,This statement acknowledges progress in implementing and improving mitigation strategies.
Brookfield_Asset_Management,2023,"In 2023, AusNet completed a seven-year program to install the world’s first deployment of Rapid Earth Fault Current Limiter (REFCL) technology designed to mitigate powerline-related ignition risks in 22 high risk bushfire areas across the electricity distribution network.",,,3,This statement acknowledges progress in completing a seven-year program to install REFCL technology.
Brookfield_Asset_Management,2023,"We invest in, enhance and monitor dam safety initiatives to mitigate future risks and adapt to changing climate conditions.",5,"This statement refers to a detailed plan or roadmap for investing in, enhancing, and monitoring dam safety initiatives.",,
Brookfield_Asset_Management,2023,"We recently partnered with the U.S. Department of Energy to further research the impact of climate change (e.g., flooding and drought) on rivers that feed into our hydropower generation assets.",5,This statement refers to a detailed plan or roadmap for partnering with the U.S. Department of Energy to research the impact of climate change.,,
Brookfield_Asset_Management,2023,Reducing the impact of our overall water consumption is an important area of focus for our portfolio companies.,2,This statement refers to a generic/high-level commitment to reduce water consumption.,,
Brookfield_Asset_Management,2023,"In the due diligence process, we identified heat stress as a future risk for the development. In response, we integrated additional resiliency considerations to ensure the development was designed to mitigate the potential for urban heat island effects under different future climate scenarios.",5,This statement refers to a detailed plan or roadmap for integrating resiliency considerations to mitigate future heat stress risk.,,
Brookfield_Asset_Management,2023,"Climate risk and opportunity management is an evolving aspect of our business. We recognize that there are a number of uncertainties and dependencies in understanding and addressing these risks and opportunities. Climate science, as well as associated methodologies, scenario analysis and industry standards, continue to evolve and there continue to be challenges with data quality and availability. Furthermore, other externalities, including technology, and economic and geopolitical events may have an evolving or unexpected impact. As such, we will continue to refine our understanding of how transition and physical climate issues may impact our portfolio companies and assets, and we expect to continue making enhancements to the way we assess, manage and report on climate-related risks and opportunities as we learn from our own experiences and incorporate advancements in climate science, relevant standards and best practices.",2,"This statement shows a generic/high-level commitment to managing climate-related risks and opportunities, and to continue refining their understanding and approach.",,
Brookfield_Asset_Management,2023,"Brookfield is aligned with the global ambition to achieve net zero across all assets under management by 2050. Achieving this will require mobilizing capital, a paradigm shift in how assets are managed, and government support through policy and regulation.",4,This statement shows a specific commitment to a net-zero or carbon-neutral target by 2050.,,
Brookfield_Asset_Management,2023,We set an ambition to reach net zero by 2050 or sooner and became a signatory to the Net Zero Asset Managers (NZAM) initiative in 2021.,"4, 6","This statement shows a specific commitment to a net-zero or carbon-neutral target by 2050 or sooner. | The company has made a commitment based on an external framework, the Net Zero Asset Managers (NZAM) initiative.",3,The company acknowledges progress towards their commitment by becoming a signatory to the NZAM initiative in 2021.
Brookfield_Asset_Management,2023,"We are committed to transparency, creating a high-quality and comprehensive emissions inventory and reporting on our progress to our stakeholders.",5,This statement shows a commitment to a detailed plan or roadmap for creating an emissions inventory and reporting progress.,,
Brookfield_Asset_Management,2023,"As we make progress advancing our investments toward decarbonization, we expect to iterate on our process, evaluate our net-zero progress and reset near-term targets bearing in mind our long-term ambition and NZAM commitment.",5,This statement shows a commitment to a detailed plan or roadmap for evaluating progress and adjusting targets.,5,The company mentions updating or extending their commitments as they make progress towards decarbonization.
Brookfield_Asset_Management,2023,"We are initially prioritizing Operationally Managed assets to implement emission reduction strategies, though we continue to conduct stewardship practices across our remaining AUM.",3,The company has a specific numeric target to prioritize Operationally Managed assets for emission reduction strategies.,,
Brookfield_Asset_Management,2023,We are committed to exhausting all other means of decarbonization and expect to utilize certified high-quality carbon offsets or removals only in instances where there are no technologically and/or financially viable ways to eliminate residual emissions.,2,The company has a generic/high-level commitment to exhaust all means of decarbonization before resorting to carbon offsets or removals.,,
Brookfield_Asset_Management,2023,All portfolio company decarbonization efforts are acknowledged and we will encourage these portfolio companies to continuously reassess decarbonization opportunities as these factors continue to evolve.,2,The company has a generic/high-level commitment to encourage portfolio companies to continuously reassess decarbonization opportunities.,,
Brookfield_Asset_Management,2023,"In another instance, in 2023, Brookfield Real Estate executed a programmatic agreement with Brookfield Renewable to install rooftop solar panels on select logistics facilities in the United States.",,,3,The company acknowledges progress/achievement of a past commitment to install rooftop solar panels on select logistics facilities.
Brookfield_Asset_Management,2023,Cbus Property has also set a net-zero carbon in operation target for the building upon completion.,4,The company has a net-zero or carbon-neutral target for the building upon completion.,,
Brookfield_Asset_Management,2023,"The redevelopment of E-Valley included a focus on leading sustainability and technical credentials, and is expected to achieve net-zero operations when complete.",4,The company has a net-zero or carbon-neutral target for the E-Valley redevelopment project.,,
Brookfield_Asset_Management,2023,We recognize that large-scale private sector financing for both developed and emerging economies is critical to achieve net zero.,2,The company has a generic/high-level commitment to achieve net zero through large-scale private sector financing.,,
Brookfield_Asset_Management,2023,"Over the last three years, Brookfield established ourselves as a leader in private fund transition investing with Global Transition Funds (BGTF I and II) dedicated to accelerating the shift to a net-zero economy.",,,3,The company acknowledges progress/achievement of a past commitment to establish Global Transition Funds dedicated to accelerating the shift to a net-zero economy.
Brookfield_Asset_Management,2023,"Looking ahead, one of the ways we expect to grow is through our Renewable Power & Transition business. As of today, we are on our way to raising our target of $40 billion in transition capital to be deployed in developed and emerging markets. We expect to grow our Transition business to $200 billion over the next decade.",3,This statement includes a specific numeric target for growth in the Renewable Power & Transition business.,,
Brookfield_Asset_Management,2023,"Brookfield’s first Global Transition Fund has already resulted in 820,199 MWh of clean energy produced, 57,000 tons annually of carbon captured and 592,142 mtCO e of emissions avoided as of December 31, 2023.",,,3,"This statement acknowledges progress made on past commitments, specifically the achievements of the Global Transition Fund."
Brookfield_Asset_Management,2023,"In 2023, we issued approximately $6.5 billion in green bonds, sustainability-linked debt and green preferred securities.",,,3,"This statement acknowledges progress made on past commitments, specifically the issuance of green bonds and other sustainability-linked financial instruments."
Brookfield_Asset_Management,2023,"We do not have a firmwide exclusion policy on coal or other fossil fuel investments. Similarly, we do not believe in divestment of high-emitting industries. Rather, we believe that there is significant value in supporting decarbonization of the highest-emitting sectors where we can deliver the greatest level of impact.",2,"This statement includes a high-level commitment to support decarbonization efforts, but does not provide specific numeric targets or detailed plans.",,
Brookfield_Asset_Management,2023,"In 2022 and 2023, Brookfield invested $12 billion into clean energy assets, over 3 times more than into sectors with significant fossil fuel exposure, outpacing the overall market, which committed only 1.6 times as much capital into clean energy as they did into fossil fuels, according to the International Energy Agency.",,,3,"This statement acknowledges progress made on past commitments, specifically the investment in clean energy assets."
Brookfield_Asset_Management,2023,"In October 2022, AdventHealth, a faith-based health system headquartered in Altamonte Springs, Florida, signed the U.S. Department of Health and Human Services Climate Pledge, committing to reduce its GHG emissions by 50% by 2030, and to being net zero by 2050.",4,"This statement includes a net-zero or carbon-neutral target for AdventHealth, a client of Brookfield.",,
Brookfield_Asset_Management,2023,This plan aims to reduce GHG emissions from,5,"The statement refers to a plan, which indicates a detailed plan or roadmap for reducing GHG emissions.",,
Brookfield_Asset_Management,2023,"In its first year using Parity, the Olivia has seen a 24% decrease in electricity and natural gas consumption, avoiding over 580 metric tons of GHG emissions and saving over $315,000.",,,3,The statement refers to a past commitment and acknowledges progress made in reducing GHG emissions.
Brookfield_Asset_Management,2023,Climate change and the transition to a lower-carbon economy present potential risks and opportunities for our portfolio companies and assets.,2,The statement refers to a generic/high-level commitment to transition to a lower-carbon economy.,,
Brookfield_Asset_Management,2023,"We partner with our stakeholders to actively facilitate knowledge sharing, advance climate priorities and provide support in achieving their decarbonization ambitions.",2,The statement refers to a generic/high-level commitment to support stakeholders in achieving their decarbonization ambitions.,,
Brookfield_Asset_Management,2023,"In 2023, this covered a broad range of topics, including our net-zero ambition, climate strategy, climate risk and opportunity assessments, scenario analysis, GHG emissions measurement, and emission reduction strategies.",4,"The statement refers to a net-zero ambition, which indicates a net-zero or carbon-neutral target.",2,"The statement mentions past commitments, but the status of these commitments is unknown."
Brookfield_Asset_Management,2023,"The need for climate action has never been more urgent, and finance plays a vital role in the transition to a more sustainable and inclusive global economy.",2,The statement refers to a generic/high-level commitment to transition to a more sustainable and inclusive global economy.,,
Brookfield_Asset_Management,2023,CFLI Colombia works to meaningfully accelerate the country’s transition to a net-zero economy.,4,"The statement refers to a net-zero target, which indicates a net-zero or carbon-neutral target.",,
Brookfield_Asset_Management,2023,"Specifically, we have directed our efforts on the measurement of the scope 1 and 2 emissions of",3,"The statement refers to a specific numeric target, as it mentions the measurement of scope 1 and 2 emissions.",,
