Category,Year,Statement,TaxonomyA_Categories,TaxonomyA_Explanations,TaxonomyB_Categories,TaxonomyB_Explanations
Brookfield_Asset_Management,2023,"We conducted a materiality assessment leveraging feedback from our business groups, leaders across the organization, investors and other external experts.",,,3,This statement acknowledges progress on a past commitment to conduct a materiality assessment.
Brookfield_Asset_Management,2023,"In working toward our net-zero ambition, we are increasingly focused on the measurement of climate-related indicators and evaluation of our progress against past performance.","4, 5","The company mentions a net-zero ambition, which is a forward-looking commitment. | The company is measuring climate-related indicators and evaluating progress, which suggests a detailed plan or roadmap.",3,"The company is evaluating progress against past performance, which suggests they are acknowledging progress or achieved targets."
Brookfield_Asset_Management,2023,We continue to review our annual reporting and aim to enhance our disclosures in line with evolving best practices to offer greater transparency into our programs and performance.,2,The company is making a high-level commitment to enhance their disclosures and offer greater transparency.,5,"The company is reviewing their annual reporting, which suggests they are updating or extending their commitments."
Brookfield_Asset_Management,2023,Brookfield Corporate Emissions Scope 1 Direct2 mtCOe  363 454 365 377 358,,,3,"The company is reporting on past emissions, which suggests they are acknowledging progress or achieved targets."
Brookfield_Asset_Management,2023,"GHG Emissions of Controlled Portfolio Companies 2023 2022 20205 Scope 1 & 26 mtCOe  9,382,697 9,586,335 N/A 9,782,536 N/A",,,3,"The company is reporting on past emissions of controlled portfolio companies, which suggests they are acknowledging progress or achieved targets."
Brookfield_Asset_Management,2023,"EMISSIONS OF NON-CONTROLLED PORTFOLIO COMPANIES1 GREENHOUSE GAS EMISSIONS UNIT 2023 Scope 3 Category 15: Financed Emissions mtCO e 12,925,432",,,3,"The company is reporting on past emissions of non-controlled portfolio companies, which suggests they are acknowledging progress or achieved targets."
Brookfield_Asset_Management,2023,2023 reporting year as the initial year of reporting for its non-controlled investments' financed emissions.,3,This statement refers to a specific future commitment to start reporting non-controlled investments' financed emissions from 2023.,,
Brookfield_Asset_Management,2023,"For our corporate operation emissions, historically fugitive emissions from leased facilities were reported in scope 2. In 2023, using guidance from the GHG Protocol, we started reporting fugitive emissions from all facilities (owned & leased) under scope 1. To ensure consistent year-over-year comparison, we restated scope 1 and scope 2 for the periods 2019 to 2022 to align with 2023 fugitive emissions reporting.",5,This statement refers to a detailed plan or roadmap for how Brookfield will report fugitive emissions under scope 1 starting from 2023.,"3, 5",This statement acknowledges progress in the company's past commitment to report fugitive emissions from leased facilities under scope 2. | This statement refers to an updated commitment to report fugitive emissions from all facilities (owned & leased) under scope 1 starting from 2023.
Brookfield_Asset_Management,2023,Brookfield has not obtained external assurance for this year's report.,,,4,This statement acknowledges a shortfall or missed target in the company's past commitment to obtain external assurance for its sustainability report.
Brookfield_Asset_Management,2023,"We recognize that strong governance is essential to sustainable business operations, and we aim to conduct our business according to the highest ethical and legal standards. Brookfield has an established framework comprising corporate policies covering all areas of the business.",2,"This statement refers to a high-level commitment to sustainable business operations and ethical standards, but does not provide specific numeric targets or detailed plans.",,
Brookfield_Asset_Management,2023,"These policy commitments were approved by Brookfield's highest governing body, apply to Brookfield's activities, and are communicated publicly through the responsibility section of our website.",2,"This statement refers to a high-level commitment to sustainable business operations and ethical standards, but does not provide specific numeric targets or detailed plans.",2,"This statement refers to past commitments, but the status of these commitments is not specified."
Brookfield_Asset_Management,2023,"For a description of financial implications and other risks and opportunities due to climate change, please refer to the Climate-related Disclosures report section, pages 22-87.",5,This statement refers to a detailed plan or roadmap for addressing the financial implications and risks of climate change.,,
Brookfield_Asset_Management,2023,"Brookfield operates in sectors such as renewable energy, where various tax credits and incentives are offered by governments in the ordinary course of business and in accordance with local tax legislation.",2,"This statement refers to a high-level commitment to operating in sectors such as renewable energy, but does not provide specific numeric targets or detailed plans.",,
Brookfield_Asset_Management,2023,"We have identified reduction in energy consumption at our office properties as a priority and are continuing to assess and develop capabilities to quantify, measure and disclose emissions reduction efforts.",2,This statement shows a generic/high-level commitment to reducing energy consumption and emissions in the future.,,
Brookfield_Asset_Management,2023,"We have identified reduction in energy consumption at our portfolio companies as a priority and are continuing to assess and develop capabilities to quantify, measure and disclose emissions reduction efforts.",2,This statement shows a generic/high-level commitment to reducing energy consumption and emissions in the future.,,
Brookfield_Asset_Management,2023,We will continue to collect water-related KPIs to help us assess the progress we have made to reduce any water-related impacts over time and will incorporate any relevant lessons learned into our procedures.,2,This statement shows a generic/high-level commitment to reducing water-related impacts in the future.,,
Brookfield_Asset_Management,2023,We believe understanding our biodiversity impacts is key to operating successful businesses. We understand the importance of measuring our impacts and are beginning to collect a number of biodiversity-related KPIs from our portfolio companies.,2,This statement shows a generic/high-level commitment to understanding and reducing biodiversity impacts in the future.,,
Brookfield_Asset_Management,2023,"We are in early stages of collecting this information from our portfolio companies and do not yet have sufficient data to provide meaningful reporting and, where relevant, will aim to make improvements to our data collection process over time.",2,"This statement indicates a high-level commitment to improve data collection processes over time, which can be seen as a forward-looking commitment.",,
Brookfield_Asset_Management,2023,Our Direct (Scope 1) GHG emissions are calculated following our internal methodology based on the GHG Protocol Corporate Accounting and Reporting Standard.,,,3,This statement acknowledges progress in calculating GHG emissions based on an established methodology.
Brookfield_Asset_Management,2023,Our indirect (Scope 2) GHG emissions are calculated following our internal methodology based on the (1) GHG Protocol Corporate Accounting and Reporting Standard and (2) GHG Protocol - Scope 2 Guidance.,,,3,This statement acknowledges progress in calculating GHG emissions based on an established methodology.
Brookfield_Asset_Management,2023,"Our indirect (Scope 3) GHG emissions are calculated following our internal methodology based on the (1) GHG Protocol Corporate Accounting and Reporting Standard, (2) GHG Protocol - The Corporate Value Chain (Scope 3) Accounting and Reporting Standard and (3) GHG Protocol - Technical Guidance for Calculating Scope 3 Emissions.",,,3,This statement acknowledges progress in calculating GHG emissions based on an established methodology.
Brookfield_Asset_Management,2023,We will continue to collect waste-related KPIs to help us assess the progress we have made to reduce any waste-related impacts over time and will incorporate any relevant lessons learned into our procedures.,2,"This statement indicates a high-level commitment to continue collecting waste-related KPIs and to reduce waste-related impacts over time, which can be seen as a forward-looking commitment.",,
Brookfield_Asset_Management,2023,"While Brookfield has not set any Firm-level waste-related targets, we will continue to report on our efforts.",2,"This statement indicates a high-level commitment to continue reporting on waste-related efforts, which can be seen as a forward-looking commitment.",,
Brookfield_Asset_Management,2023,"Define the organization’s objectives to reach net zero by 2050 or sooner, in line with science-based pathways to limit warming to 1.5 degrees C, stating clearly defined and measurable interim and long-term targets and strategic timelines, and identify the priority financing strategies of net-zero transition action to enable real economy emissions reduction.","4, 3, 5, 6","The statement mentions a net-zero target by 2050 or sooner, which falls under the 'Net-Zero or Carbon-Neutral Target' category. | The statement also mentions specific numeric targets and strategic timelines, which falls under the 'Specific Numeric Target' category. | The statement outlines a plan for achieving the net-zero target, which falls under the 'Detailed Plan or Roadmap' category. | The statement refers to science-based pathways, which falls under the 'Science-Based or External Framework Commitment' category.",,
Brookfield_Asset_Management,2023,"Establish a suite of metrics and targets to drive execution of the net-zero transition plan and monitor progress of results in the near, medium, and long term. Include metrics and targets focused on aligning financial activity in support of the real-economy net-zero transition; on executing the transition plan; and on measuring changes in client and portfolio GHG emissions.","3, 5","The statement mentions specific numeric targets, which falls under the 'Specific Numeric Target' category. | The statement outlines a plan for achieving the net-zero target, which falls under the 'Detailed Plan or Roadmap' category.",,
Brookfield_Asset_Management,2023,Total emissions currently include scope 1 and 2. We intend to include material scope 3 emissions at a future time when we are able to gather sufficiently high-quality data.,2,"The statement mentions a generic commitment to include scope 3 emissions in the future, which falls under the 'Generic/High-Level Commitment' category.",,
Brookfield_Asset_Management,2023,Our emissions calculation includes scope 2 market-based emissions and is guided by the principles of the GHG Protocol Corporate Accounting and Reporting Standard issued by the World Business Council for Sustainable Development and the World Resource Institute.,6,"The statement refers to the GHG Protocol Corporate Accounting and Reporting Standard, which falls under the 'Science-Based or External Framework Commitment' category.",,
Brookfield_Asset_Management,2023,"10 Represents initial assets included in Brookfield's NZAM interim target and the inclusion of additional assets. AUM is as of December 31, 2022.",3,This statement refers to a specific numeric target (NZAM interim target) that Brookfield has set for its assets.,,
Brookfield_Asset_Management,2023,"14 For renewable and clean energy acquisitions made prior to December 31, 2025. For renewable and clean energy acquisitions made post-2025, we will set targets aligned with science-based pathways.",6,"This statement refers to future commitments that Brookfield plans to make, which will be aligned with science-based pathways.",,
Brookfield_Asset_Management,2023,"23 Base year figures disclosed represent 2020 with the exception of Real Estate for which the base year is 2019. Base year emissions are recalculated where there are significant changes to the data, inventory boundary, methods, or any other relevant factors, which could be triggered by structural changes, changes in methodology and new or additional data.",,,2,"This statement refers to past commitments, specifically the base year figures for emissions, but it does not provide information on whether these commitments were met or not."
Brookfield_Asset_Management,2023,"24 In line with the GHG protocol, emissions for 2020 and 2022 have been restated to reflect material acquisitions and dispositions. Values are estimations and subject to change upon acquisitions, new or additional data or upon verification of the GHG inventory.",,,3,This statement acknowledges progress in terms of restating emissions for 2020 and 2022 in line with the GHG protocol.
