Category,Year,Statement,TaxonomyA_Categories,TaxonomyA_Explanations,TaxonomyB_Categories,TaxonomyB_Explanations
Brookfield_Asset_Management,2023,We continue to prioritize the identification and execution of commercially viable opportunities to decarbonize our assets in line with our ambition to reach net zero.,4,"The company has a net-zero target, which is a forward-looking commitment.",,
Brookfield_Asset_Management,2023,"While we will be measuring progress over time, our ambition to achieve net zero by 2050 should be viewed in the spirit that it is intended, which is to drive the widest decarbonization impact while maintaining our fiduciary duty.",4,The company has a specific target year (2050) for achieving net-zero emissions.,,
Brookfield_Asset_Management,2023,"We will strive for and measure success in a variety of ways, including reductions in our absolute emissions and emissions intensity, expansion in the scope of asset coverage in our emissions inventory, and advancement of our portfolio companies along a decarbonization pathway.",5,The company has a detailed plan for measuring success in their decarbonization efforts.,,
Brookfield_Asset_Management,2023,"We know that collection and access to high quality emissions data is imperative to assessing our decarbonization progress. Our initial focus has been on robust, bottom-up measurement",5,The company has a detailed plan for collecting and accessing high-quality emissions data to assess their decarbonization progress.,,
Brookfield_Asset_Management,2023,"While our objective is to encourage and achieve maximum decarbonization potential across all of our investments, we recognize that our ability to control and influence outcomes varies widely across our asset base.",2,The company has a high-level commitment to encourage and achieve maximum decarbonization potential across all investments.,,
Brookfield_Asset_Management,2023,We focus on supporting our portfolio companies on their decarbonization journey. Key initiatives driving decarbonization progress this year across our business groups are highlighted below:,5,The company has a detailed plan for supporting their portfolio companies on their decarbonization journey.,3,The company acknowledges progress in their decarbonization efforts.
Brookfield_Asset_Management,2023,"We became a signatory to NZAM in 2021, joining an international group of asset managers committed, consistent with fiduciary duties to clients and beneficiaries, to supporting the goal of net zero emissions by 2050 or sooner.",6,The company has made a commitment based on an external framework (NZAM).,2,The company mentions a past commitment (becoming a signatory to NZAM in 2021).
Brookfield_Asset_Management,2023, is in line with global efforts to limit warming to well-below 2 degrees Celsius and to support investment aligned with net zero emissions by 2050 or sooner.,4,"The statement mentions a commitment to align with net zero emissions by 2050 or sooner, which is a net-zero or carbon-neutral target.",,
Brookfield_Asset_Management,2023,"We agreed to set an interim target for a portion of our AUM with the ambition to reduce emissions by 50% by 2030, as well as review our interim target at least every five years.","3, 5",The statement mentions a specific numeric target of reducing emissions by 50% by 2030. | The commitment to review the interim target at least every five years indicates a detailed plan or roadmap.,,
Brookfield_Asset_Management,2023,"We originally set $147 billion of assets on a path to net zero emissions by 2050 from a 2020 base year.8 In 2022, we increased our target to $201 billion.",4,"The statement mentions a commitment to set a certain amount of assets on a path to net zero emissions by 2050, which is a net-zero or carbon-neutral target.",3,The statement acknowledges progress on a past commitment by mentioning that the target was increased from $147 billion to $201 billion.
Brookfield_Asset_Management,2023,Other key targets and achievements across our business include Brookfield’s Renewable Power & Transition business’ commitment to achieve net zero in its operations across scope 1 and 2 by 2030.,4,"The statement mentions a commitment to achieve net zero in its operations across scope 1 and 2 by 2030, which is a net-zero or carbon-neutral target.",,
Brookfield_Asset_Management,2023,"Also, Brookfield's Real Estate group is committed to powering its U.S. office portfolio with clean energy by 2026 and Brookfield Real Estate's India portfolio set an ambition to reach net-zero emissions by 2040.","4, 3","The statement mentions a commitment to reach net-zero emissions by 2040, which is a net-zero or carbon-neutral target. | The commitment to power the U.S. office portfolio with clean energy by 2026 is a specific numeric target.",,
Brookfield_Asset_Management,2023,"Office Portfolio references the draft SBTi Buildings Guidance internal expertise to provide training. We see great oppor- Sustainability at Brookfield net zero alignment standard, developed in collaboration with Carbon Risk Real Estate Monitor (CRREM), as its applicable decarbonization pathway.","4, 6","The statement refers to a net-zero alignment standard, indicating a commitment to a net-zero or carbon-neutral target. | The statement mentions the SBTi Buildings Guidance and CRREM, indicating a commitment based on external frameworks.",,
Brookfield_Asset_Management,2023,"Assets in this portfolio continue to progress towards 5–10- year emissions reduction targets, including by procuring clean energy.",3,The statement mentions specific numeric targets for emissions reduction over a defined time period.,3,The statement acknowledges progress towards past commitments.
Brookfield_Asset_Management,2023,"Importantly, we are committed to advancing portfolio compa- nies’ decarbonization journey even if it is not feasible for them to immediately conform to a net-zero aligned pathway.",2,"The statement expresses a high-level commitment to advancing decarbonization, even if immediate net-zero alignment is not feasible.",,
Brookfield_Asset_Management,2023,"Over the coming decades, we may consider decarbonizing, repurposing, repositioning, or phasing-out approaches, depending on the nature and specific economic circumstances, which are aligned with net-zero expectations.",4,"The statement refers to future considerations aligned with net-zero expectations, indicating a commitment to a net-zero or carbon-neutral target.",,
Brookfield_Asset_Management,2023,We have measured and tracked emissions across our busi- ness groups for several years.,,,3,The statement acknowledges past efforts to measure and track emissions.
Brookfield_Asset_Management,2023,Brookfield's corporate scope 1 emissions decreased due to reduced natural gas consumption and fugitive emissions.,,,3,The statement acknowledges progress in reducing past emissions.
Brookfield_Asset_Management,2023,"We continue to focus our efforts on lowering our firm’s corporate emissions, including by powering the majority of our office sites with clean energy.",2,The statement expresses a high-level commitment to reducing corporate emissions and using clean energy.,,
Brookfield_Asset_Management,2023,GHG emissions across our controlled portfolio companies in 2023 were 9.4 million mtCOe. Our controlled portfolio company emissions declined compared to prior year emissions of 9.6 million mtCOe and base year emissions of 9.8 million mtCOe.,,,3,The statement acknowledges progress in reducing past emissions.
Brookfield_Asset_Management,2023,"Infrastructure’s business has a decreasing trend, approximately 50% relative to base year, and 8% from 2022, driven by increased business activity and revenues since 2020.",3,The statement mentions a specific numeric target for decreasing emissions.,3,The statement acknowledges progress towards the target.
Brookfield_Asset_Management,2023,"Across our Real Estate business, total scope 1 and 2 emissions for controlled portfolio companies were 851,368 mtCO 2e. This is a 15% reduction from its base year emissions of 1,002,065 mtCOe, and a 15% reduction from 2022 of 1,006,442 mtCOe.",3,The statement mentions a specific numeric target for reducing emissions.,3,The statement acknowledges progress towards the target.
Brookfield_Asset_Management,2023,"Within our Private Equity business, total scope 1 and 2 emissions for controlled portfolio companies were 3,350,384 mtCOe. This is a 22% reduction.",3,The statement mentions a specific numeric target for reducing emissions.,3,The statement acknowledges progress towards the target.
Brookfield_Asset_Management,2023,"Going forward, we will endeavor to improve access to information to increase data quality, primarily across our financed emissions, to achieve 100% disclosure coverage.",5,The statement outlines a detailed plan or roadmap for improving data quality and disclosure coverage.,,
Brookfield_Asset_Management,2023,We expect it to incorporate an increasing focus on scope 3 emissions over time.,2,The statement makes a generic/high-level commitment to focus more on scope 3 emissions in the future.,,
Brookfield_Asset_Management,2023,"We aim to protect biodiversity throughout the life cycle of our investments, including by encouraging the consideration of nature when evaluating new investments.",2,This statement shows a high-level commitment to protect biodiversity throughout the life cycle of investments.,,
Brookfield_Asset_Management,2023,"During the first phase of the framework’s implementation, we seek to provide training and resources to enable a pilot project with a small number of portfolio companies data collection, and where appropriate, we engage local community members, Indigenous groups and experts to monitor nature impacts and conduct studies to further our conservation efforts.",5,This statement refers to a detailed plan or roadmap for implementing a framework to monitor nature impacts and further conservation efforts.,,
Brookfield_Asset_Management,2023,"In 2024, Renewable Power & Transition will implement its Biodiversity Management Framework across all its development and operational assets, prioritizing sites in ecologically sensitive areas.",3,This statement refers to a specific numeric target for the implementation of the Biodiversity Management Framework in 2024.,,
Brookfield_Asset_Management,2023,"As well, in 2023, Brookfield Real Estate began a portfolio-wide assessment of its nature risks and opportunities, working toward developing a nature management framework to align with the TNFD recommendations.",5,This statement refers to a detailed plan or roadmap for developing a nature management framework aligned with TNFD recommendations.,3,This statement acknowledges progress made in 2023 when Brookfield Real Estate began a portfolio-wide assessment of its nature risks and opportunities.
Brookfield_Asset_Management,2023,"Looking ahead, we continue to evaluate how we can enhance our strategy, share key learnings and continue to incorporate nature-related considerations throughout the investment process, including by identifying opportunities complementary to our value creation model.",2,This statement shows a high-level commitment to continue incorporating nature-related considerations throughout the investment process.,,
Brookfield_Asset_Management,2023,"Brookfield Infrastructure’s U.K. Regulated Utility business, SGN, has committed land across its company portfolio to biodiversity enhancement projects to reverse species decline and create green spaces. In 2023, 114 biodiversity baseline studies were carried out and seven improvement projects were implemented.",3,This statement refers to a specific numeric target for carrying out biodiversity baseline studies and implementing improvement projects.,3,This statement acknowledges progress made in 2023 when 114 biodiversity baseline studies were carried out and seven improvement projects were implemented.
Brookfield_Asset_Management,2023,"We continue to collect metrics related to water use and scarcity, as well as hazardous and non-hazardous waste generation.",2,"This statement shows a generic/high-level commitment to monitoring environmental metrics, including water use and waste generation.",,
Brookfield_Asset_Management,2023,"In the case of Verfrut, by installing a floating solar panel farm on the reservoir, it provides the site with renewable electricity while simultaneously reducing evaporation from the irrigation reservoir by 60%.",3,This statement shows a specific numeric target of reducing evaporation from the irrigation reservoir by 60% through the installation of a floating solar panel farm.,3,This statement acknowledges progress towards the specific target of reducing evaporation from the irrigation reservoir.
Brookfield_Asset_Management,2023,"To minimize water withdrawals and consumption, Brookfield Real Estate have invested in robust leak detection programs across its assets and installed efficient faucet aerators and low-flow fixtures.",5,This statement shows a detailed plan or roadmap for minimizing water withdrawals and consumption through various measures.,,
Brookfield_Asset_Management,2023,38 % water consumption reduction since FY 2019-20,,,3,"This statement acknowledges progress towards the goal of reducing water consumption, with a 38% reduction since FY 2019-20."
Brookfield_Asset_Management,2023,"Every day across its global system, Clarios collects and turns around 8,000 used batteries into new units with the goal of ensuring all vehicle batteries are not only responsibly designed but can be economically and responsibly recovered and repurposed.",5,"This statement shows a detailed plan or roadmap for managing used batteries, with a specific daily target of repurposing 8,000 units.",,
Brookfield_Asset_Management,2023,"Ecoworld’s waste management strategy completely changed the building’s waste profile. It reduced landfilled waste from 60% to 3%, and recycled waste increased from 40% in 2015 to 97% in 2021.",,,3,"This statement acknowledges progress towards the goal of reducing landfilled waste and increasing recycled waste, with specific figures provided for the changes achieved."
Brookfield_Asset_Management,2023,"Brookfield expects employees to understand their strengths, recognize their weaknesses, be willing to stretch outside their comfort zones, and be willing to ask for help when necessary.",2,"This statement refers to a high-level commitment to employee development and growth, but does not provide specific numeric targets or detailed plans.",,
Brookfield_Asset_Management,2023,Our focus on the long term is more than just an investment strategy: it is also central to our hiring philosophy.,2,"This statement refers to a high-level commitment to long-term focus in hiring, but does not provide specific numeric targets or detailed plans.",,
Brookfield_Asset_Management,2023,"Brookfield is committed to a hiring process that is objective, nondiscriminatory and in compliance with all applicable legislation and good governance.",2,"This statement refers to a high-level commitment to an objective and nondiscriminatory hiring process, but does not provide specific numeric targets or detailed plans.",,
Brookfield_Asset_Management,2023,Our grow-from-within talent strategy prioritizes internal mobility to provide opportunities to expand professional experience and enhance collaboration across the business.,2,"This statement refers to a high-level commitment to internal mobility and talent development, but does not provide specific numeric targets or detailed plans.",,
Brookfield_Asset_Management,2023,"Over the last five years, we have more than doubled our employee population, which means we have many people in new roles.",,,3,"This statement refers to past commitment to increase the employee population, and acknowledges progress in achieving this goal."
Brookfield_Asset_Management,2023,We believe that strong sustainability management is inextricably linked to the success of a business. We actively look to advance sustainability initiatives and improve sustainability performance in driving long-term value creation throughout the life cycle of our investments.,2,"This statement shows a high-level commitment to sustainability and improving sustainability performance, but does not provide specific numeric targets or detailed plans.",,
Brookfield_Asset_Management,2023,"In 2022, Connor was appointed President of the separately listed Brookfield Asset Management, where he is responsible for strategy and delivery across Brookfield’s investment activities.",,,3,This statement acknowledges progress in the form of a past appointment and the responsibilities that came with it.
Brookfield_Asset_Management,2023,"In 2021, Anuj moved to London responsible for growing Brookfield’s private equity group east of the Atlantic, before being named President of the global private equity group in 2022.",,,3,This statement acknowledges progress in the form of past appointments and the responsibilities that came with them.
Brookfield_Asset_Management,2023,"In May 2024, Hadley was appointed Chief Financial Officer of Brookfield Asset Management.",,,3,This statement acknowledges progress in the form of a past appointment.
Brookfield_Asset_Management,2023,"In early 2024, Anuj was appointed as CEO of the private equity business responsible for the investments, operations and expansion of the group globally, in addition to managing Brookfield’s external strategic partnerships.",,,3,This statement acknowledges progress in the form of a past appointment and the responsibilities that came with it.
Brookfield_Asset_Management,2023,Brookfield’s approach to executive compensation is designed to reinforce long-term stewardship of the business in line with our goal of creating exceptional value for our shareholders and investors.,2,"This statement shows a high-level commitment to long-term stewardship and value creation, but does not provide specific numeric targets or detailed plans.",,
Brookfield_Asset_Management,2023,"Over the past five years, our primary focus has been on gender diversity. Our efforts led to a significant increase in female representation at the senior levels. We have more than doubled our employee population and significantly increased our female representation at the most senior level of the organization during this period—Managing Partner/ Managing Director female representation increased from 12% to 22%. In addition, Senior Vice President representation increased from 26% to 35% during this time. The discipline embedded into our recruit- ing and performance management processes has been instrumental in this progress.",2,"The company has made a high-level commitment to gender diversity, but no specific numeric targets are mentioned.",3,The company acknowledges progress in increasing female representation at senior levels.
Brookfield_Asset_Management,2023,"Our portfolio companies support the career development, advancement and inclusion of women in traditionally male-dominated roles within trade industries. Several of our portfolio companies have developed programs that help to support women in pursuing a trade career.",2,"The company has made a high-level commitment to supporting women in traditionally male-dominated roles, but no specific numeric targets are mentioned.",2,"The company mentions past commitments to support women in traditionally male-dominated roles, but the status of these commitments is unknown."
Brookfield_Asset_Management,2023,"To achieve our goal of zero serious safety incidents, Brookfield has adopted a common set of health and safety principles, which guide the health and safety practices of our portfolio companies.",3,The company has a specific numeric target of zero serious safety incidents.,1,No past commitment is mentioned in this statement.
Brookfield_Asset_Management,2023,We continue to raise awareness and commit to providing human rights training to new employees who participate in our investment advisory business and those in high-risk roles.,2,This statement refers to a generic/high-level commitment to raise awareness and provide training on human rights to new employees.,,
Brookfield_Asset_Management,2023,"In relation to human rights, as part of our due diligence process and ongoing management, we give consideration to the Organization for Economic Co-operation and Development (OECD) Guidelines for Multinational Enterprises and the United Nations Guiding Principles on Business and Human Rights.",6,"This statement refers to a commitment to consider international frameworks (OECD Guidelines and UN Guiding Principles) in their due diligence process and ongoing management, which is a science-based or external framework commitment.",,
Brookfield_Asset_Management,2023,"We are committed to conducting our business in an ethical and responsible manner, including by carrying out our activities in a manner that respects fundamental human rights and aimed at: a. the elimination of discrimination in employment; b. the prohibition of child and forced labor; and c. the eradication of harassment and physical or mental abuse in the workplace.",3,"This statement refers to specific numeric targets related to human rights, including the elimination of discrimination, prohibition of child and forced labor, and eradication of harassment and abuse in the workplace.",,
Brookfield_Asset_Management,2023,"We strive to embed this into our core business activities, including training, communications, contracts and due diligence processes set out in our Human Rights and Anti-Modern Slavery Policy (Human Rights Policy)",5,"This statement refers to a detailed plan or roadmap for embedding human rights considerations into their core business activities, including training, communications, contracts, and due diligence processes.",,
Brookfield_Asset_Management,2023,The human rights and modern slavery specific annex to our Sustainability Due Diligence Protocol is intended to support our investment teams in identifying the nature and extent of exposure to human rights violations.,5,This statement refers to a detailed plan or roadmap for supporting investment teams in identifying exposure to human rights violations.,,
Brookfield_Asset_Management,2023,"Investment teams are required to maintain records of assessed risks and, where appropriate, we perform deeper due diligence, working with internal experts and third-party consultants as needed.",5,This statement refers to a detailed plan or roadmap for maintaining records of assessed risks and performing deeper due diligence when necessary.,,
Brookfield_Asset_Management,2023,We continue to raise awareness and commit to providing human rights training to new employees who participate in our investment advisory business and those in high-risk,2,This statement shows a generic/high-level commitment to providing human rights training to new employees.,,
Brookfield_Asset_Management,2023,"Going forward, Brookfield Renewable Power & Transition will continue building on its human rights programs and work directly with its supply chain and industry associations to enhance traceability across its supply chain.",2,This statement shows a generic/high-level commitment to building on human rights programs and enhancing traceability across the supply chain.,,
Brookfield_Asset_Management,2023,"In 2023, 100% of our fully-onboarded controlled portfolio companies had an Anti-Bribery and Corruption Policy and a Code of Conduct.",,,3,This statement acknowledges progress/achievement of past commitment of having an Anti-Bribery and Corruption Policy and a Code of Conduct in all fully-onboarded controlled portfolio companies.
Brookfield_Asset_Management,2023,"In 2023, our portfolio companies completed ~215,000 hours of ABC training.",,,3,This statement acknowledges progress/achievement of past commitment of providing ABC training to portfolio companies.
Brookfield_Asset_Management,2023,"We have a zero-tolerance approach to bribery, including facilitation payments. We mandate that all Brookfield employees complete annual anti-bribery and corruption (ABC) training and certify their compliance with our ABC Policy.",2,This statement shows a generic/high-level commitment to a zero-tolerance approach to bribery and to providing annual ABC training to all employees.,,
Brookfield_Asset_Management,2023,"In 2023, we undertook initiatives to further enhance our data protection and threat-intelligence capabilities, and to improve our processes for third-party risk management.",3,This statement refers to a specific numeric target set in the future (2023).,,
Brookfield_Asset_Management,2023,We review and update our cybersecurity program annually and conduct regular external-party assessments of our program maturity based on the NIST Cybersecurity Framework.,5,This statement refers to a detailed plan or roadmap for updating and assessing the cybersecurity program.,,
Brookfield_Asset_Management,2023,"Brookfield is committed to preventing its business from being used for money laundering, terrorist financing and related financial crimes activities, and to complying fully with applicable anti-money laundering laws, regulations and related requirements.",2,This statement refers to a generic/high-level commitment to prevent financial crimes.,,
Brookfield_Asset_Management,2023,Brookfield maintains Guidelines for the Preparation & Use of Advertisements and the Engagement of Promoters in connection with Marketing Activities.,2,This statement refers to a generic/high-level commitment to maintain guidelines for marketing activities.,,
Brookfield_Asset_Management,2023,"Throughout our operations and asset management activities, we seek to support and treat with respect the communities in which we operate.",2,This statement refers to a generic/high-level commitment to support and respect communities.,,
